{
  "days": {
    "2026-11-01": {
      "catalogVersion": "2026-10-05.0396bc77",
      "direction": "tem",
      "family": "rotulo",
      "mal": true,
      "number": 25,
      "param": "Drama",
      "rounds": [
        {
          "a": "fixture:tr:tr05",
          "answer": "a",
          "b": "fixture:tr:tr25"
        },
        {
          "a": "fixture:tr:tr09",
          "answer": "b",
          "b": "fixture:tr:tr37"
        },
        {
          "a": "fixture:tr:tr22",
          "answer": "a",
          "b": "fixture:tr:tr31"
        },
        {
          "a": "fixture:tr:tr33",
          "answer": "a",
          "b": "fixture:tr:tr36"
        },
        {
          "a": "fixture:tr:tr39",
          "answer": "a",
          "b": "fixture:tr:tr17"
        },
        {
          "a": "fixture:tr:tr23",
          "answer": "a",
          "b": "fixture:tr:tr29"
        },
        {
          "a": "fixture:tr:tr42",
          "answer": "b",
          "b": "fixture:tr:tr24"
        },
        {
          "a": "fixture:tr:tr38",
          "answer": "a",
          "b": "fixture:tr:tr27"
        },
        {
          "a": "fixture:tr:tr08",
          "answer": "a",
          "b": "fixture:tr:tr10"
        },
        {
          "a": "fixture:tr:tr01",
          "answer": "a",
          "b": "fixture:tr:tr41"
        },
        {
          "a": "fixture:tr:tr07",
          "answer": "a",
          "b": "fixture:tr:tr21"
        }
      ]
    },
    "2026-11-02": {
      "catalogVersion": "2026-10-05.0396bc77",
      "direction": "min",
      "family": "playlists",
      "mal": true,
      "number": 26,
      "rounds": [
        {
          "a": "fixture:tr:tr40",
          "answer": "b",
          "b": "fixture:tr:tr26",
          "info": {
            "playlists": [
              7,
              3
            ]
          }
        },
        {
          "a": "fixture:tr:tr35",
          "answer": "b",
          "b": "fixture:tr:tr09",
          "info": {
            "playlists": [
              35,
              31
            ]
          }
        },
        {
          "a": "fixture:tr:tr23",
          "answer": "b",
          "b": "fixture:tr:tr01",
          "info": {
            "playlists": [
              355,
              230
            ]
          }
        },
        {
          "a": "fixture:tr:tr24",
          "answer": "a",
          "b": "fixture:tr:tr20",
          "info": {
            "playlists": [
              97,
              150
            ]
          }
        },
        {
          "a": "fixture:tr:tr19",
          "answer": "a",
          "b": "fixture:tr:tr36",
          "info": {
            "playlists": [
              3,
              41
            ]
          }
        },
        {
          "a": "fixture:tr:tr32",
          "answer": "a",
          "b": "fixture:tr:tr36",
          "info": {
            "playlists": [
              8,
              41
            ]
          }
        },
        {
          "a": "fixture:tr:tr31",
          "answer": "a",
          "b": "fixture:tr:tr21",
          "info": {
            "playlists": [
              6,
              820
            ]
          }
        },
        {
          "a": "fixture:tr:tr29",
          "answer": "a",
          "b": "fixture:tr:tr05",
          "info": {
            "playlists": [
              5,
              60
            ]
          }
        },
        {
          "a": "fixture:tr:tr18",
          "answer": "a",
          "b": "fixture:tr:tr23",
          "info": {
            "playlists": [
              28,
              355
            ]
          }
        },
        {
          "a": "fixture:tr:tr30",
          "answer": "a",
          "b": "fixture:tr:tr31",
          "info": {
            "playlists": [
              2,
              6
            ]
          }
        },
        {
          "a": "fixture:tr:tr38",
          "answer": "b",
          "b": "fixture:tr:tr40",
          "info": {
            "playlists": [
              55,
              7
            ]
          }
        },
        {
          "a": "fixture:tr:tr05",
          "answer": "a",
          "b": "fixture:tr:tr22",
          "info": {
            "playlists": [
              60,
              165
            ]
          }
        },
        {
          "a": "fixture:tr:tr39",
          "answer": "b",
          "b": "fixture:tr:tr31",
          "info": {
            "playlists": [
              22,
              6
            ]
          }
        },
        {
          "a": "fixture:tr:tr07",
          "answer": "b",
          "b": "fixture:tr:tr40",
          "info": {
            "playlists": [
              47,
              7
            ]
          }
        },
        {
          "a": "fixture:tr:tr01",
          "answer": "a",
          "b": "fixture:tr:tr42",
          "info": {
            "playlists": [
              230,
              405
            ]
          }
        },
        {
          "a": "fixture:tr:tr15",
          "answer": "a",
          "b": "fixture:tr:tr39",
          "info": {
            "playlists": [
              4,
              22
            ]
          }
        },
        {
          "a": "fixture:tr:tr34",
          "answer": "a",
          "b": "fixture:tr:tr20",
          "info": {
            "playlists": [
              88,
              150
            ]
          }
        },
        {
          "a": "fixture:tr:tr33",
          "answer": "b",
          "b": "fixture:tr:tr41",
          "info": {
            "playlists": [
              120,
              64
            ]
          }
        },
        {
          "a": "fixture:tr:tr31",
          "answer": "a",
          "b": "fixture:tr:tr08",
          "info": {
            "playlists": [
              6,
              15
            ]
          }
        },
        {
          "a": "fixture:tr:tr09",
          "answer": "a",
          "b": "fixture:tr:tr06",
          "info": {
            "playlists": [
              31,
              268
            ]
          }
        },
        {
          "a": "fixture:tr:tr30",
          "answer": "a",
          "b": "fixture:tr:tr16",
          "info": {
            "playlists": [
              2,
              72
            ]
          }
        },
        {
          "a": "fixture:tr:tr27",
          "answer": "b",
          "b": "fixture:tr:tr06",
          "info": {
            "playlists": [
              310,
              268
            ]
          }
        },
        {
          "a": "fixture:tr:tr09",
          "answer": "b",
          "b": "fixture:tr:tr37",
          "info": {
            "playlists": [
              31,
              14
            ]
          }
        },
        {
          "a": "fixture:tr:tr25",
          "answer": "b",
          "b": "fixture:tr:tr29",
          "info": {
            "playlists": [
              12,
              5
            ]
          }
        },
        {
          "a": "fixture:tr:tr10",
          "answer": "a",
          "b": "fixture:tr:tr42",
          "info": {
            "playlists": [
              190,
              405
            ]
          }
        },
        {
          "a": "fixture:tr:tr30",
          "answer": "a",
          "b": "fixture:tr:tr17",
          "info": {
            "playlists": [
              2,
              18
            ]
          }
        }
      ]
    },
    "2026-11-03": {
      "catalogVersion": "2026-10-05.0396bc77",
      "direction": "min",
      "family": "amq",
      "mal": true,
      "number": 27,
      "rounds": [
        {
          "a": "fixture:tr:tr29",
          "answer": "a",
          "b": "fixture:tr:tr36",
          "info": {
            "rates": [
              21.1,
              48.6
            ]
          }
        },
        {
          "a": "fixture:tr:tr27",
          "answer": "a",
          "b": "fixture:tr:tr23",
          "info": {
            "rates": [
              83.5,
              85.7
            ]
          }
        },
        {
          "a": "fixture:tr:tr15",
          "answer": "a",
          "b": "fixture:tr:tr21",
          "info": {
            "rates": [
              18.0,
              94.2
            ]
          }
        },
        {
          "a": "fixture:tr:tr23",
          "answer": "b",
          "b": "fixture:tr:tr10",
          "info": {
            "rates": [
              85.7,
              77.1
            ]
          }
        },
        {
          "a": "fixture:tr:tr38",
          "answer": "b",
          "b": "fixture:tr:tr40",
          "info": {
            "rates": [
              59.9,
              26.3
            ]
          }
        },
        {
          "a": "fixture:tr:tr09",
          "answer": "b",
          "b": "fixture:tr:tr37",
          "info": {
            "rates": [
              44.9,
              38.8
            ]
          }
        },
        {
          "a": "fixture:tr:tr19",
          "answer": "a",
          "b": "fixture:tr:tr23",
          "info": {
            "rates": [
              10.5,
              85.7
            ]
          }
        },
        {
          "a": "fixture:tr:tr39",
          "answer": "a",
          "b": "fixture:tr:tr01",
          "info": {
            "rates": [
              40.2,
              79.8
            ]
          }
        },
        {
          "a": "fixture:tr:tr08",
          "answer": "a",
          "b": "fixture:tr:tr23",
          "info": {
            "rates": [
              37.4,
              85.7
            ]
          }
        },
        {
          "a": "fixture:tr:tr42",
          "answer": "b",
          "b": "fixture:tr:tr34",
          "info": {
            "rates": [
              88.9,
              63.8
            ]
          }
        },
        {
          "a": "fixture:tr:tr42",
          "answer": "b",
          "b": "fixture:tr:tr07",
          "info": {
            "rates": [
              88.9,